656803770073010176	can't even  # hitonyourmom  @ midnight  
656832460622286848	you're never too old to get a spanking  # hitonyourmom  @ midnight 
656817247210577920	hi mom , it's me , ed . you know , you're long lost son , ed dippus . # hitonyourmom  @ midnight 
656869892554002432	# hitonyourmom hey mom , how about a creampie for dessert ? @ midnight 
656801201812586496	@ midnight your cookies are delicious  # hitonyourmom 
656798758261387264	actual lineage be damned . tonight i'm your daddy . # hitonyourmom  @ midnight 
656842270398914560	"i'm just admiring my pearl necklace mrs . cleaver . # hitonyourmom  @ midnight "" "
656795460397568000	'cause every mother's day needs a mother's night ! # hitonyourmom  # lonelyisland  @ midnight 
656808556339986432	hey  @ midnight  # maybeonedayican  # hitonyourmom . okay i'll wait until  # backtofutureday to slip her my  # nerdoween . # lifegoals 
656815808828411904	you taught me everything you know , now let me show you what i know  # hitonyourmom  @ midnight 
656817797662576640	hey we haven't done this in awhile but can we brest feed again  # hitonyourmom  @ midnight 
656750130511544320	oh yeah , say my middle name . # hitonyourmom  @ midnight 
656844566109155328	you may not have seen purple underwear , but have you received a purple mushroom ? # hitonyourmom  @ midnight  # backtothefuture 
656822377238646784	who cares if you have kids , or if i'm one of them . . . # hitonyourmom  @ midnight 
656842472795062272	"hmmm . . . smurfette underpants , who'd a guessed it . # hitonyourmom  @ midnight "" "
656799251280867329	i'm not angry i'm just disappointed in your erection  @ hardwick  @ midnight  # hitonyourmom 
656867071108628480	wanna get oedipus wrecked ? # hitonyourmom  @ midnight 
656674043375034368	those capri's would look better on my bedroom floor . # hitonyourmom  @ midnight 
656839990404513793	got milk  # hitonyourmom  @ midnight 
656799273548447744	i know i'm 33 , is that too old to breastfeed ? # hitonyourmom  @ midnight 
656812002673864704	@ midnight   # hitonyourmom for sure i thought  @ tycertank would get into this one 
656839079292706816	i only talk back cuz you know you like it  @ midnight  # hitonyourmom 
656826011590389760	# hitonyourmom you need to be with someone that knows you inside out  @ midnight 
656852837725577217	great scott ! ! that s your mom ! ? ? # hitonyourmom  # backtothefuture  @ midnight 
656838665231036416	"* gets baseball bat * thwack thwack thwack  "" sorry mom , thank  @ hardwick it was this or incestuous lesbian tweets "" # hitonyourmom  @ midnight "
656794139971993600	dad is good and all , but i inherited grandpa's 'd' ! # hitonyourmom  @ midnight  @ hardwick 
656831941669449729	wanna have some fun behind the dumpster at chuck e . cheese ? # hitonyourmom  @ midnight 
656809174744043520	its  # backtofutureday how about i throw you legs back behind your head  # hitonyourmom  @ midnight 
656822612522332160	what happened next is only available on pay-per-view . 
656793992860839936	mommy , can you kiss my boo boo and make it better ? # hitonyourmom  @ midnight 
656809846403043329	in c'est si bon ? # hitonyourmom  @ midnight 
656797322630795264	"you dare me to what ? uh , ok . smack ! oh , you said  "" on "" . my bad . sorry , mom . either way , dude , you are so messed up . # hitonyourmom  @ midnight "
656854470731497473	i don't wanna  # hitonyourmom  @ midnight 
656813420033871872	what say you and i sneak off and corrupt the family gene pool ? # hitonyourmom  @ midnight 
656793413594009600	pop them tig ol' bitties in my mouth  # hitonyourmom  @ midnight  @ hardwick 
656819335143542784	just saying your moms got ass too ! # hitonyourmom  @ midnight 
656866497567002624	cool mom's love their sunny's d . # hitonyourmom  @ midnight 
656828856524013568	we already live together . let's consummate the relationship  # hitonyourmom  @ midnight 
656856468512243712	"# hitonyourmom  "" i need you to check for monsters . . . in my pants . ""@ midnight "
656799608253861889	your mother and i would like you to reverse your circumcision . # hitonyourmom  @ midnight  @ hardwick 
656856264304128000	start at b5 and work your way down vertically til you find her battleship  # hitonyourmom  # winningatbattleship  @ midnight 
656859185699643392	in 60 years , is it likely to matter ? # hitonyourmom  @ midnight 
656795041931898880	@ midnight the most creepiest  # hashtagwars ever ! ! ! # hitonyourmom i mean ewww ! ! sheesh that's in the creeper zone ! 
656863326752780289	i was inside of you for nine months . what's another 3 minutes ? # hitonyourmom  @ midnight 
656679274905079810	# hitonyourmom  @ midnight wow mom you're so hot , mmph , grpmmh oh god i just threw up in my mouth . can't do it . whew , i'm not a weirdo . 
656817928491376640	my bad i  # hitonyourmom i thought she was one of your friends . . . besides she is still in my age range 37-87 ! @ midnight 
656829493336780800	remember when you would breast-feed me ? let's get nostalgic  # hitonyourmom  @ midnight 
656816260555128832	how's it going missy ? . . . i mean mom  # hitonyourmom  @ midnight 
656867800842022912	after you finish my laundry i got one more load . @ midnight  # hitonyourmom  # backtofutureday 
656824599334768641	mom , will you be my sexual offender because i really want to feel violated right now . # hitonyourmom  @ midnight 
656812114036834308	@ vancityreynolds  @ midnight  # hitonyourmom 
656841386180935680	wouldn't this make me a necrophiliac ? # hitonyourmom  @ midnight 
656867325015031809	that's right . i've been a bad boy . i think i need a good spanking  # hitonyourmom  @ midnight 
656817513611796480	my father never  # hitonyourmom that was me that sent that carrier pigeon and the hard candy . @ midnight 
656821035954778114	i can't take you back to the future , but i can slip you a piece of the past  # hitonyourmom  @ midnight 
656820157575204865	i just want to see where she gets her skills from . . . hearing is way different from seeing   # hitonyourmom  @ midnight 
656793869393219584	i may be grounded but my dick is sky-high  # hitonyourmom  @ midnight 
656794866328936448	i don't want you to  # hitonyourmom but if she is a milf i will be happy to   @ midnight 
656821946445864960	it's time for me to leave some dna in  * your * jeans . # hitonyourmom  @ midnight 
656855362860027904	i heard your in to sports i've got some balls for you to play with  # hitonyourmom  @ midnight 
656855116423630849	technically its  # hitonyourmom so i won't hit on my mom i'll hit on yours  @ midnight 
656800067974770689	those are some nice cookies you've for there . . . would you like to dip then in my milk  # hitonyourmom  @ midnight  @ hardwick  @ nerdistmom 
656858552984670208	so  @ hardwick , how many people  # hitonyourmom last night ? @ midnight 
656832952198938624	you know they say incest is the best  # hitonyourmom  @ midnight god i feel gross 
656796063119122437	wow , mrs . c . , i'm lovin' the suv but we passed the soccer feilds about a mi--- ohh . . . # hitonyourmom   @ midnight  # miker 
656866009735827456	that's right , i want her dead . no trail . she'll be alone at 7 : 00pm while making dinner . do it then . # hitonyourmom  @ midnight 
656826778120380416	uh . . . uhm . . . would you . . . uh . . . i mean , do you , um , can we go . . . uh , i'd like to take you to the . . . . to the dance . # hitonyourmom  @ midnight 
656826592430325760	came out of it and i'd like to go back in  ; ) # hitonyourmom  @ midnight 
656792329303425025	@ midnight mom , the reason i don't ever have clean underwear is that my bunghole uses 1 . 21 gigawatts of power  # hitonyourmom 
656868412627537921	"@ midnight you better believe  i get it from  "" my momma "" # hitonyourmom "
656850476466462720	nothing gets between me and my calvin klein jeans . o . k . mom , except your hands . # hitonyourmom  @ midnight 
656818761438228480	don't worry your son will never find out until third period  # hitonyourmom  @ midnight 
656833479674564608	my dick hurts will you kiss it and make it feel better  # hitonyourmom  @ midnight 
656673988643418112	how about we play reverse-birth ? # hitonyourmom  @ midnight 
656836947470487552	@ midnight mom i need help putting lotion on . . . . . . mhhhh . rub it like that . . . . . . faster . . . . . ohhhhhhhhh ! ! ! ! # hitonyourmom 
656832762985496577	wanna binge watch bates motel ? # hitonyourmom  @ midnight 
656828383821766656	you know i got these beautiful eyes from you  # hitonyourmom  @ midnight 
656799953512103936	@ midnight  # hitonyourmom   wow spelled backwards is wow . upside down is mom , and that's the way dad likes her ! 
656841240915243008	"let's get together for some  "" bangers and mash "" i got the banger  # hitonyourmom  @ midnight "
656821975084568577	i cleaned my room . # hitonyourmom  @ midnight 
656854051838005248	but we're still cousins , right ? # hitonyourmom  @ midnight 
656853093515173888	i'm going to squeeze through this wet doorway while you push on my taint ! # hitonyourmom  @ midnight  @ hardwick 
656852650114314240	how you doin' ? # hitonyourmom  @ midnight  @ hardwick 
656799866228752384	good morning mommy , do you want breakfast in bed , or incest in bed ? # hitonyourmom  @ midnight 
656850207192182784	@ midnight  # hitonyourmom take out your dentures , pretend you're me as an infant and it's dinner time . . . 
656815812771233792	"@ midnight  "" call me daddy ! "" # hitonyourmom "
656797020091514880	# hitonyourmom  @ midnight not touching this one with a ten foot pole . 
656792428205109248	@ midnight mom , be careful , that's heavy  # hitonyourmom 
656854626361217025	i've got this rockin' spaceshi  . . . car , rocking car that has christmas lights and gets a little loose at  # 88mph . # hitonyourmom  @ midnight 
656804348496912384	i'm gonna make you scream my first , middle , and last name because i've been a real bad boy . # hitonyourmom   @ midnight 
656808070434131969	no one can touch my privates cept you mommy or my doctor  # hitonyourmom  @ midnight 
656692949757988865	i can wear a tom selleck mask . # hitonyourmom  @ midnight 
656840701053935616	"holds boom box over head cusack style outside of stacey's house . hits play . # hitonyourmom  @ midnight "" "
656686259679666177	# hitonyourmom hey baby why don't you come over , light some candles , and criticize my life choices ? @ midnight 
656859134818578433	@ midnight i'm gay and i'm suprised at how many  # hitonyourmom tweets i made last night . 
656857331410599936	@ midnight don't need to , my mom knows what's up . that's her on the left  # hitonyourmom  
656830935774662656	i made you a pizza with extra sausage  # hitonyourmom  @ midnight 
656796779002900484	this tag is trending in west virgina . . . # hitonyourmom  @ midnight  @ hardwick 
656677187047825408	give me two of your flexeril and 15 minutes and i'll mess up your other hip . # hitonyourmom  @ midnight 
656801646194765824	 . @ mhryvnak  @ nerdistmom  @ midnight matlock  & amp ; chill ? # hitonyourmom 
656793203136446464	i can tell by the number of kid stickers on your back car window that you like to fuck so we doing this or not ? # hitonyourmom  @ midnight 
656677917980807169	want to turn every room in the house into my childhood bedroom ? # hitonyourmom  @ midnight 
656673795122556928	# hitonyourmom  @ midnight can i stay the night in my old womb ? 
656844417014194176	wanna watch moody oprah ? # hitonyourmom  @ midnight 
656830176970452992	@ midnight  # hitonyourmom is the creepiest hash tag ever ! i can't even , but the comedians were funny tho ! 
656813482373832704	hey mom lets do it like they do on the discovery channel   # hitonyourmom  @ midnight  @ hardwick 
656840215047311360	let's see if our kids have our eyes . # hitonyourmom  @ midnight 
656844354267447296	# hitonyourmom uh-uh . . . no no no ! @ midnight 
656822457454755840	@ midnight plz post pic of  @ hardwick handing over his purple , phallic , ( back ) massager to  @ nerdistmom even though  # hitonyourmom is over . thx 
656860985697939456	i'm about to wreck that vagina . . . again ! # hitonyourmom  @ midnight 
656818324714704896	are you tired ? because you've been mall-walking through my mind all day ! # hitonyourmom  @ midnight 
656861041817735168	hey mom , i know where dad's plugged in at ! @ midnight  # hitonyourmom 
656866744368132096	tell me more about why you hate jan at the office . # hitonyourmom  @ midnight 
656800881258577921	hey hot mama ! how about you let me get as deep into that oedipussy as before i was born ? # hitonyourmom  @ midnight 
656843077408002048	"@ midnight thanks i now know how horrible i am . . . "" are you lactating , or are you just happy to see me ? "" # hitonyourmom "
656850539838357504	mom ! ! ! stay out of my room ! ! ! unless you lookin niceeeee  # hitonyourmom  @ midnight 
656803068919611393	my report card may be all a's , but i'm here to give you a d  # hitonyourmom  @ midnight 
656807007882727424	hey mom , can i have the keys to my first apartment ? # hitonyourmom  @ midnight 
656822755770298368	@ mementh  @ midnight i wanted to , but she told me we shouldn't ruin a good friendship . # hitonyourmom 
656866330516332549	how about i  put your eye out  # hitonyourmom  @ midnight 
656801185437847552	feel like leaving it to the beaver , mrs . cleaver ? # hitonyourmom  @ midnight 
656832288274186240	i hear you're really into diaper foreplay  # hitonyourmom  @ midnight 
656816354494955520	mom , can you read me a story ? * hands her fifty shades of grey * # hitonyourmom  @ midnight 
